{"$schema":"http://json-schema.org/draft-07/schema#","description":"Recurring words in the verified discography titles, grouped into named families. Every claim is a count of titles containing the word; no meanings are invented.","properties":{"families":{"items":{"properties":{"epithet":{"type":"string"},"name":{"type":"string"},"track_count":{"minimum":1,"type":"integer"},"tracks":{"items":{"properties":{"date":{"type":["string","null"]},"plays":{"type":["integer","null"]},"title":{"type":"string"},"type":{"type":"string"}},"required":["title","type"],"type":"object"},"type":"array"},"words":{"items":{"type":"string"},"type":"array"}},"required":["name","epithet","words","track_count","tracks"],"type":"object"},"type":"array"},"generated":{"format":"date","type":"string"},"method":{"type":"string"},"version":{"type":"string"}},"required":["version","generated","method","families"],"title":"Aster da Master — Vocabulary Codex","type":"object"}